{
  "chapter": 13,
  "title": {
    "sanskrit": "",
    "transliteration": "",
    "ru": {
      "text": "Подчиненное и господствующее начала",
      "approved": true
    },
    "en": {
      "text": "Distinction Between Matter and Spirit",
      "approved": true
    },
    "de": {
      "text": "DREIZEHNTES KAPITEL Prakṛti-Puruṣa-Viveka-Yoga Der Pfad des Unterscheidens zwischen Spirituellem und Materiellem",
      "approved": true
    },
    "es": {
      "text": "Pakriti–purusha–viveka–yoga. La Conciencia y la Materia: El Predominante y el Predominado",
      "approved": true
    }
  },
  "meta": {
    "totalSlokas": 31,
    "lastUpdated": "2026-03-26T05:31:42Z",
    "version": "1.0",
    "source": "SM/SCSM/ШМ/ШЧСМ"
  },
  "slokas": [
    {
      "number": "13.1",
      "order": 1,
      "sanskrit": "अर्जुन उवाच ।\nप्रकृतिं पुरुषं चैव क्षेत्रं क्षेत्रज्ञमेव च ।\nएतद्वेदितुमिच्छामि ज्ञानं ज्ञेयं च केशव  ॥१॥",
      "transliteration": "арджуна ува̄ча\nпракр̣тим̇ пуруш̣ам̇ чаива, кш̣етрам̇ кш̣етраджн̃ам эва ча\nэтад ведитум иччха̄ми, джн̃а̄нам̇ джн̃ейам̇ ча кеш́ава",
      "translations": {
        "ru": {
          "text": "Арджуна сказал: О Кешава! Я желаю знать о материальной энергии и о Том, Кто повелевает ей. Хочу постичь поле деятельности и знающего это поле, услышать от Тебя о подлинном знании и объекте познания.",
          "approved": true
        },
        "en": {
          "text": "Arjuna said: O Keśava, I would like to know about material nature, the person, the field, the knower of the field, knowledge, and the object of knowledge.",
          "approved": true
        },
        "de": {
          "text": "1  Arjuna sagte: ‚O Keśava, ich würde gern etwas über die ma-terielle Natur, die Person, das Feld, den Kenner des Feldes, das  Wissen und den Gegenstand des Wissens erfahren.‘",
          "approved": true
        },
        "es": {
          "text": "Arjuna dijo: ¡Oh Keśava!, quisiera conocer acerca de la naturaleza material, la persona, el campo, el conocedor del campo, el conocimiento y el objeto del conocimiento.",
          "approved": true
        }
      },
      "audio": {
        "recitation": "/Files/80e742ecbd0d4c48943c1591987175e0.mp3",
        "sanskrit": "/Files/97ca8df8f9f94967ab8df654bf1ce104.mp3"
      },
      "vocabulary": [
        {
          "word": "арджуна",
          "transliteration": "",
          "meaning": {
            "ru": {
              "text": "Арджуна",
              "approved": true
            }
          },
          "order": 1
        },
        {
          "word": "ува̄ча",
          "transliteration": "",
          "meaning": {
            "ru": {
              "text": "сказал",
              "approved": true
            }
          },
          "order": 2
        },
        {
          "word": "пракр̣тим",
          "transliteration": "",
          "meaning": {
            "ru": {
              "text": "материальную природу",
              "approved": true
            }
          },
          "order": 3
        },
        {
          "word": "пуруш̣ам",
          "transliteration": "",
          "meaning": {
            "ru": {
              "text": "Повелителя материальной энергии",
              "approved": true
            }
          },
          "order": 4
        },
        {
          "word": "ча эва",
          "transliteration": "",
          "meaning": {
            "ru": {
              "text": "и также",
              "approved": true
            }
          },
          "order": 5
        },
        {
          "word": "кш̣етрам",
          "transliteration": "",
          "meaning": {
            "ru": {
              "text": "поле деятельности",
              "approved": true
            }
          },
          "order": 6
        },
        {
          "word": "кш̣етра-джн̃ам",
          "transliteration": "",
          "meaning": {
            "ru": {
              "text": "знающего это поле деятельности",
              "approved": true
            }
          },
          "order": 7
        },
        {
          "word": "ча эва",
          "transliteration": "",
          "meaning": {
            "ru": {
              "text": "и также",
              "approved": true
            }
          },
          "order": 8
        },
        {
          "word": "этат",
          "transliteration": "",
          "meaning": {
            "ru": {
              "text": "все это",
              "approved": true
            }
          },
          "order": 9
        },
        {
          "word": "ведитум",
          "transliteration": "",
          "meaning": {
            "ru": {
              "text": "постичь",
              "approved": true
            }
          },
          "order": 10
        },
        {
          "word": "иччха̄ми",
          "transliteration": "",
          "meaning": {
            "ru": {
              "text": "я желаю",
              "approved": true
            }
          },
          "order": 11
        },
        {
          "word": "джн̃а̄нам",
          "transliteration": "",
          "meaning": {
            "ru": {
              "text": "знание",
              "approved": true
            }
          },
          "order": 12
        },
        {
          "word": "джн̃ейам",
          "transliteration": "",
          "meaning": {
            "ru": {
              "text": "и объект познания",
              "approved": true
            }
          },
          "order": 13
        },
        {
          "word": "ча",
          "transliteration": "",
          "meaning": {
            "ru": {
              "text": "и",
              "approved": true
            }
          },
          "order": 14
        },
        {
          "word": "кеш́ава",
          "transliteration": "",
          "meaning": {
            "ru": {
              "text": "о Кеш́ава, победитель демона Кеш́и",
              "approved": true
            }
          },
          "order": 15
        }
      ]
    },
    {
      "number": "13.2",
      "order": 2,
      "sanskrit": "श्रीभगवानुवाच ।\nइदं शरीरं कौन्तेय क्षेत्रमित्यभिधीयते ।\nएतद्यो वेत्ति तं प्राहुः क्षेत्रज्ञ इति तद्विदः ॥२॥",
      "transliteration": "ш́рӣ бхагава̄н ува̄ча\nидам̇ ш́арӣрам̇ каунтейа, кш̣етрам итй абхидхӣйате\nэтад йо ветти там̇ пра̄хух̣, кш̣етраджн̃а ити тад видах̣",
      "translations": {
        "ru": {
          "text": "Всевышний сказал: Арджуна, это тело известно как поле деятельности. Душу, пребывающую в нем, мудрецы описывают как сознающего это поле.",
          "approved": true
        },
        "en": {
          "text": "The Supreme Lord said: O Arjuna, this body is known as the field. One who knows this field is described by the learned as the knower of the field.",
          "approved": true
        },
        "de": {
          "text": "2  Der Höchste Herr sagte: ‚O Sohn Kuntis, dieser Körper ist als  das Feld bekannt. Derjenige, der dieses Feld kennt, wird von den  Gelehrten als der Kenner des Feldes beschrieben.",
          "approved": true
        },
        "es": {
          "text": "El Supremo Señor dijo: ¡Oh Arjuna!, este cuerpo es conocido como el campo. Aquel que conoce este campo es descrito por los sabios como el conocedor del campo.",
          "approved": true
        }
      },
      "audio": {
        "recitation": "/Files/7bd938439d4a40ce8d63c329ffa05675.mp3",
        "sanskrit": "/Files/93765a949e0a432e8496eb0fcdcee04c.mp3"
      },
      "vocabulary": [
        {
          "word": "ш́рӣ бхагава̄н",
          "transliteration": "",
          "meaning": {
            "ru": {
              "text": "Всевышний",
              "approved": true
            }
          },
          "order": 1
        },
        {
          "word": "ува̄ча",
          "transliteration": "",
          "meaning": {
            "ru": {
              "text": "сказал",
              "approved": true
            }
          },
          "order": 2
        },
        {
          "word": "идам",
          "transliteration": "",
          "meaning": {
            "ru": {
              "text": "это",
              "approved": true
            }
          },
          "order": 3
        },
        {
          "word": "ш́арӣрам",
          "transliteration": "",
          "meaning": {
            "ru": {
              "text": "тело",
              "approved": true
            }
          },
          "order": 4
        },
        {
          "word": "каунтейа",
          "transliteration": "",
          "meaning": {
            "ru": {
              "text": "сын Кунтӣ",
              "approved": true
            }
          },
          "order": 5
        },
        {
          "word": "кш̣етрам",
          "transliteration": "",
          "meaning": {
            "ru": {
              "text": "поле деятельности",
              "approved": true
            }
          },
          "order": 6
        },
        {
          "word": "ити абхи-дхӣйате",
          "transliteration": "",
          "meaning": {
            "ru": {
              "text": "известно как",
              "approved": true
            }
          },
          "order": 7
        },
        {
          "word": "этат",
          "transliteration": "",
          "meaning": {
            "ru": {
              "text": "это тело",
              "approved": true
            }
          },
          "order": 8
        },
        {
          "word": "йах̣",
          "transliteration": "",
          "meaning": {
            "ru": {
              "text": "кто",
              "approved": true
            }
          },
          "order": 9
        },
        {
          "word": "ветти",
          "transliteration": "",
          "meaning": {
            "ru": {
              "text": "сознает",
              "approved": true
            }
          },
          "order": 10
        },
        {
          "word": "там",
          "transliteration": "",
          "meaning": {
            "ru": {